{
  "document_id": "CF-012",
  "annotator": "adjudicated",
  "groundtruth_version": "groundtruth-v0.1-pilot",
  "annotation_status": "adjudicated",
  "pilot_slice": { "pages": [2, 3, 4], "description": "Adjudicated ground truth for CF-012 pilot slice." },
  "nodes": [
    { "id": "CF-012/p2/act1", "type": "heading", "subtype": "act_title", "normalized_content": "Public Law 117-169, 117th Congress - An Act", "source_order": 1, "provenance": { "document_id": "CF-012", "page_number": 2, "bbox": null, "text_anchor": "Public Law 117\u2013169" }, "confidence": "high", "state": "ok", "notes": null },
    { "id": "CF-012/p2/title1", "type": "heading", "subtype": "title", "normalized_content": "TITLE I - COMMITTEE ON FINANCE", "source_order": 2, "provenance": { "document_id": "CF-012", "page_number": 2, "bbox": null, "text_anchor": "TITLE I\u2014COMMITTEE ON FINANCE" }, "confidence": "high", "state": "ok", "notes": null },
    { "id": "CF-012/p2/subA", "type": "heading", "subtype": "subtitle", "normalized_content": "Subtitle A - Deficit Reduction", "source_order": 3, "provenance": { "document_id": "CF-012", "page_number": 2, "bbox": null, "text_anchor": "Subtitle A\u2014Deficit Reduction" }, "confidence": "high", "state": "ok", "notes": null },
    { "id": "CF-012/p2/sec10001", "type": "heading", "subtype": "section", "normalized_content": "SECTION 10001. AMENDMENT OF 1986 CODE.", "source_order": 4, "provenance": { "document_id": "CF-012", "page_number": 2, "bbox": null, "text_anchor": "SECTION 10001. AMENDMENT OF 1986 CODE." }, "confidence": "high", "state": "ok", "notes": null },
    { "id": "CF-012/p2/para10001", "type": "paragraph", "normalized_content": "Except as otherwise expressly provided ... reference shall be considered to be made to a section or other provision of the Internal Revenue Code of 1986.", "source_order": 5, "provenance": { "document_id": "CF-012", "page_number": 2, "bbox": null, "text_anchor": "reference shall be considered to be made to a section or other provision" }, "confidence": "high", "state": "ok", "notes": null },
    { "id": "CF-012/p2/part1", "type": "heading", "subtype": "part", "normalized_content": "PART 1 - CORPORATE TAX REFORM", "source_order": 6, "provenance": { "document_id": "CF-012", "page_number": 2, "bbox": null, "text_anchor": "PART 1\u2014CORPORATE TAX REFORM" }, "confidence": "high", "state": "ok", "notes": null },
    { "id": "CF-012/p2/sec10101", "type": "heading", "subtype": "section", "normalized_content": "SEC. 10101. CORPORATE ALTERNATIVE MINIMUM TAX.", "source_order": 7, "provenance": { "document_id": "CF-012", "page_number": 2, "bbox": null, "text_anchor": "SEC. 10101. CORPORATE ALTERNATIVE MINIMUM TAX." }, "confidence": "high", "state": "ok", "notes": null },
    { "id": "CF-012/p2/paraA", "type": "paragraph", "normalized_content": "(a) IMPOSITION OF TAX ... Paragraph (2) of section 55(b) is amended ... 15 percent of the adjusted financial statement income (as determined under section 56A).", "source_order": 8, "provenance": { "document_id": "CF-012", "page_number": 2, "bbox": null, "text_anchor": "Paragraph (2) of section 55(b) is amended" }, "confidence": "high", "state": "ok", "notes": null },
    { "id": "CF-012/p2/margin55", "type": "other", "subtype": "margin_note", "normalized_content": "26 USC 55.", "source_order": 9, "provenance": { "document_id": "CF-012", "page_number": 2, "bbox": null, "text_anchor": "26 USC 55." }, "confidence": "high", "state": "ok", "notes": "ADJUDICATED: statutory side citation is a margin_note (other), not a footnote (guideline changelog GC-6)." },
    { "id": "CF-012/p2/ref55", "type": "other", "subtype": "statutory_reference", "normalized_content": "Internal Revenue Code section 55(b)", "source_order": 10, "provenance": { "document_id": "CF-012", "page_number": 2, "bbox": null, "text_anchor": "section 55(b)" }, "confidence": "medium", "state": "unresolved", "notes": "ADJUDICATED: external cross-reference targets are represented as nodes with state 'unresolved', not omitted (guideline changelog GC-8)." },
    { "id": "CF-012/p2/furn1", "type": "other", "subtype": "page_furniture", "normalized_content": "136 STAT. 1818 PUBLIC LAW 117-169 - AUG. 16, 2022", "source_order": 0, "provenance": { "document_id": "CF-012", "page_number": 2, "bbox": null, "text_anchor": "136 STAT. 1818 PUBLIC LAW 117\u2013169\u2014AUG. 16, 2022" }, "confidence": "high", "state": "ok", "notes": null },
    { "id": "CF-012/p3/defterm", "type": "other", "subtype": "defined_term", "normalized_content": "'applicable corporation' means a corporation meeting the average annual adjusted financial statement income test.", "source_order": 11, "provenance": { "document_id": "CF-012", "page_number": 2, "bbox": null, "text_anchor": "the term \u2018applicable corporation\u2019" }, "confidence": "high", "state": "ok", "notes": null },
    { "id": "CF-012/p3/paratest", "type": "paragraph", "normalized_content": "a corporation meets the test ... exceeds $1,000,000,000 ... is $100,000,000 or more.", "source_order": 12, "provenance": { "document_id": "CF-012", "page_number": 3, "bbox": null, "text_anchor": "exceeds $1,000,000,000" }, "confidence": "high", "state": "ok", "notes": null },
    { "id": "CF-012/p3/margindef", "type": "other", "subtype": "margin_note", "normalized_content": "Definition.", "source_order": 13, "provenance": { "document_id": "CF-012", "page_number": 3, "bbox": null, "text_anchor": "Definition." }, "confidence": "high", "state": "ok", "notes": "ADJUDICATED: margin_note (GC-6)." }
  ],
  "edges": [
    { "id": "CF-012/e1", "type": "belongs_to", "source_id": "CF-012/p2/subA", "target_id": "CF-012/p2/title1", "confidence": "high", "state": "ok", "notes": null },
    { "id": "CF-012/e2", "type": "belongs_to", "source_id": "CF-012/p2/sec10001", "target_id": "CF-012/p2/subA", "confidence": "high", "state": "ok", "notes": null },
    { "id": "CF-012/e3", "type": "belongs_to", "source_id": "CF-012/p2/part1", "target_id": "CF-012/p2/subA", "confidence": "high", "state": "ok", "notes": null },
    { "id": "CF-012/e4", "type": "belongs_to", "source_id": "CF-012/p2/sec10101", "target_id": "CF-012/p2/part1", "confidence": "high", "state": "ok", "notes": null },
    { "id": "CF-012/e5", "type": "belongs_to", "source_id": "CF-012/p2/para10001", "target_id": "CF-012/p2/sec10001", "confidence": "high", "state": "ok", "notes": null },
    { "id": "CF-012/e6", "type": "belongs_to", "source_id": "CF-012/p2/paraA", "target_id": "CF-012/p2/sec10101", "confidence": "high", "state": "ok", "notes": null },
    { "id": "CF-012/e7", "type": "belongs_to", "source_id": "CF-012/p3/paratest", "target_id": "CF-012/p2/sec10101", "confidence": "medium", "state": "ok", "notes": null },
    { "id": "CF-012/e8", "type": "references", "source_id": "CF-012/p2/paraA", "target_id": "CF-012/p2/ref55", "confidence": "high", "state": "ok", "notes": null },
    { "id": "CF-012/e9", "type": "annotates", "source_id": "CF-012/p2/margin55", "target_id": "CF-012/p2/paraA", "confidence": "high", "state": "ok", "notes": null },
    { "id": "CF-012/e10", "type": "annotates", "source_id": "CF-012/p3/margindef", "target_id": "CF-012/p3/defterm", "confidence": "medium", "state": "ok", "notes": null }
  ],
  "facts": [
    { "id": "CF-012/f1", "subject": "corporate alternative minimum tax rate", "predicate": "is", "object": "15", "unit": "percent", "sign": "positive", "qualifier": "of adjusted financial statement income", "period": "taxable year", "source_node": "CF-012/p2/paraA", "provenance": { "document_id": "CF-012", "page_number": 2, "bbox": null, "text_anchor": "15 percent of the adjusted financial statement income" }, "confidence": "high", "state": "ok", "notes": null },
    { "id": "CF-012/f2", "subject": "average annual adjusted financial statement income test threshold", "predicate": "exceeds", "object": "1000000000", "unit": "USD", "sign": "positive", "qualifier": "3-taxable-year average; source prints $1,000,000,000", "period": "ending with the taxable year", "source_node": "CF-012/p3/paratest", "provenance": { "document_id": "CF-012", "page_number": 3, "bbox": null, "text_anchor": "exceeds $1,000,000,000" }, "confidence": "high", "state": "ok", "notes": "ADJUDICATED: numeric object normalized to bare digits; grouped form kept in qualifier (guideline changelog GC-7)." },
    { "id": "CF-012/f3", "subject": "foreign-parented group income threshold", "predicate": "is_at_least", "object": "100000000", "unit": "USD", "sign": "positive", "qualifier": "source prints $100,000,000", "period": "3-taxable-year period", "source_node": "CF-012/p3/paratest", "provenance": { "document_id": "CF-012", "page_number": 3, "bbox": null, "text_anchor": "$100,000,000 or more" }, "confidence": "high", "state": "ok", "notes": null },
    { "id": "CF-012/f4", "subject": "applicable corporation", "predicate": "is_defined_as", "object": "a corporation meeting the average annual adjusted financial statement income test", "unit": null, "sign": null, "qualifier": "excludes S corporation, RIC, REIT", "period": null, "source_node": "CF-012/p3/defterm", "provenance": { "document_id": "CF-012", "page_number": 2, "bbox": null, "text_anchor": "the term \u2018applicable corporation\u2019 means" }, "confidence": "high", "state": "ok", "notes": null }
  ]
}
