{
  "document_id": "CF-006",
  "annotator": "annotator_b",
  "groundtruth_version": "groundtruth-v0.1-pilot",
  "annotation_status": "single",
  "pilot_slice": { "pages": [1, 2, 3, 4], "description": "Docling p1-4 pilot slice." },
  "nodes": [
    { "id": "CF-006/m01", "type": "heading", "subtype": "title", "normalized_content": "Docling Technical Report", "source_order": 1, "provenance": { "document_id": "CF-006", "page_number": 1, "bbox": null, "text_anchor": "Docling Technical Report" }, "confidence": "high", "state": "ok", "notes": null },
    { "id": "CF-006/m02", "type": "paragraph", "subtype": "authors", "normalized_content": "Christoph Auer et al.; AI4K Group, IBM Research", "source_order": 2, "provenance": { "document_id": "CF-006", "page_number": 1, "bbox": null, "text_anchor": "AI4K Group, IBM Research" }, "confidence": "high", "state": "ok", "notes": null },
    { "id": "CF-006/m03", "type": "paragraph", "subtype": "abstract", "normalized_content": "This technical report introduces Docling, a self-contained, MIT-licensed open-source package for PDF document conversion.", "source_order": 3, "provenance": { "document_id": "CF-006", "page_number": 1, "bbox": null, "text_anchor": "MIT-licensed open-source package for PDF document conversion" }, "confidence": "high", "state": "ok", "notes": null },
    { "id": "CF-006/m04", "type": "heading", "normalized_content": "1 Introduction", "source_order": 4, "provenance": { "document_id": "CF-006", "page_number": 1, "bbox": null, "text_anchor": "1 Introduction" }, "confidence": "high", "state": "ok", "notes": null },
    { "id": "CF-006/m05", "type": "paragraph", "normalized_content": "Converting PDF documents back into a machine-processable format has been a major challenge for decades.", "source_order": 5, "provenance": { "document_id": "CF-006", "page_number": 1, "bbox": null, "text_anchor": "Converting PDF documents back into a machine-processable format" }, "confidence": "high", "state": "ok", "notes": null },
    { "id": "CF-006/m06", "type": "list", "normalized_content": "What Docling delivers today", "source_order": 6, "provenance": { "document_id": "CF-006", "page_number": 2, "bbox": null, "text_anchor": "Here is what Docling delivers today" }, "confidence": "high", "state": "ok", "notes": null },
    { "id": "CF-006/m07", "type": "list_item", "normalized_content": "Converts PDF documents to JSON or Markdown format, stable and lightning fast", "source_order": 7, "provenance": { "document_id": "CF-006", "page_number": 2, "bbox": null, "text_anchor": "Converts PDF documents to JSON or Markdown format" }, "confidence": "high", "state": "ok", "notes": null },
    { "id": "CF-006/m08", "type": "list_item", "normalized_content": "Understands detailed page layout, reading order, locates figures and recovers table structures", "source_order": 8, "provenance": { "document_id": "CF-006", "page_number": 2, "bbox": null, "text_anchor": "Understands detailed page layout, reading order" }, "confidence": "high", "state": "ok", "notes": null },
    { "id": "CF-006/m09", "type": "list_item", "normalized_content": "Optionally applies OCR, e.g. for scanned PDFs", "source_order": 9, "provenance": { "document_id": "CF-006", "page_number": 2, "bbox": null, "text_anchor": "Optionally applies OCR, e.g. for scanned PDFs" }, "confidence": "high", "state": "ok", "notes": null },
    { "id": "CF-006/m10", "type": "heading", "normalized_content": "2 Getting Started", "source_order": 10, "provenance": { "document_id": "CF-006", "page_number": 2, "bbox": null, "text_anchor": "2 Getting Started" }, "confidence": "high", "state": "ok", "notes": null },
    { "id": "CF-006/m11", "type": "other", "subtype": "code", "normalized_content": "from docling.document_converter import DocumentConverter; ...", "source_order": 11, "provenance": { "document_id": "CF-006", "page_number": 2, "bbox": null, "text_anchor": "from docling . d o c u m e n t _ c o n v e r t e r import" }, "confidence": "medium", "state": "uncertain", "notes": "Monospaced example; annotated as other/code (no dedicated code node used)." },
    { "id": "CF-006/m12", "type": "paragraph", "normalized_content": "Docling implements a linear pipeline of operations (see Fig. 1).", "source_order": 12, "provenance": { "document_id": "CF-006", "page_number": 2, "bbox": null, "text_anchor": "linear pipeline of operations, which execute sequentially" }, "confidence": "high", "state": "ok", "notes": null },
    { "id": "CF-006/m13", "type": "heading", "normalized_content": "3 Processing pipeline", "source_order": 13, "provenance": { "document_id": "CF-006", "page_number": 2, "bbox": null, "text_anchor": "3 Processing pipeline" }, "confidence": "high", "state": "ok", "notes": null },
    { "id": "CF-006/m14", "type": "figure", "normalized_content": "Docling processing pipeline diagram", "source_order": 14, "provenance": { "document_id": "CF-006", "page_number": 3, "bbox": null, "text_anchor": "Parse PDF pages" }, "confidence": "medium", "state": "ok", "notes": null },
    { "id": "CF-006/m15", "type": "caption", "normalized_content": "Figure 1: Sketch of Docling's default processing pipeline. The inner part of the model pipeline is easily customizable and extensible.", "source_order": 15, "provenance": { "document_id": "CF-006", "page_number": 3, "bbox": null, "text_anchor": "Figure 1: Sketch of Docling\u2019s default processing pipeline" }, "confidence": "high", "state": "ok", "notes": null },
    { "id": "CF-006/m16", "type": "paragraph", "normalized_content": "Our layout analysis model ... re-trained on DocLayNet [13].", "source_order": 16, "provenance": { "document_id": "CF-006", "page_number": 3, "bbox": null, "text_anchor": "re-trained on DocLayNet [13]" }, "confidence": "high", "state": "ok", "notes": null },
    { "id": "CF-006/m17", "type": "other", "subtype": "citation", "normalized_content": "[13] DocLayNet reference", "source_order": 17, "provenance": { "document_id": "CF-006", "page_number": 3, "bbox": null, "text_anchor": "DocLayNet [13]" }, "confidence": "low", "state": "uncertain", "notes": null },
    { "id": "CF-006/m18", "type": "paragraph", "normalized_content": "All results are shown in Table 1.", "source_order": 18, "provenance": { "document_id": "CF-006", "page_number": 4, "bbox": null, "text_anchor": "All results are shown in Table 1" }, "confidence": "high", "state": "ok", "notes": null },
    { "id": "CF-006/m19", "type": "other", "subtype": "table_reference", "normalized_content": "Table 1", "source_order": 19, "provenance": { "document_id": "CF-006", "page_number": 4, "bbox": null, "text_anchor": "shown in Table 1" }, "confidence": "low", "state": "uncertain", "notes": null }
  ],
  "edges": [
    { "id": "CF-006/be1", "type": "contains", "source_id": "CF-006/m06", "target_id": "CF-006/m07", "confidence": "high", "state": "ok", "notes": null },
    { "id": "CF-006/be2", "type": "contains", "source_id": "CF-006/m06", "target_id": "CF-006/m08", "confidence": "high", "state": "ok", "notes": null },
    { "id": "CF-006/be3", "type": "contains", "source_id": "CF-006/m06", "target_id": "CF-006/m09", "confidence": "high", "state": "ok", "notes": null },
    { "id": "CF-006/be4", "type": "belongs_to", "source_id": "CF-006/m05", "target_id": "CF-006/m04", "confidence": "high", "state": "ok", "notes": null },
    { "id": "CF-006/be5", "type": "belongs_to", "source_id": "CF-006/m11", "target_id": "CF-006/m10", "confidence": "high", "state": "ok", "notes": null },
    { "id": "CF-006/be6", "type": "references", "source_id": "CF-006/m12", "target_id": "CF-006/m14", "confidence": "high", "state": "ok", "notes": null },
    { "id": "CF-006/be7", "type": "illustrates", "source_id": "CF-006/m14", "target_id": "CF-006/m13", "confidence": "medium", "state": "uncertain", "notes": "Figure depicts the processing-pipeline section; caption folded into the figure node rather than a separate annotates edge." },
    { "id": "CF-006/be8", "type": "references", "source_id": "CF-006/m18", "target_id": "CF-006/m19", "confidence": "high", "state": "ok", "notes": null },
    { "id": "CF-006/be9", "type": "cites", "source_id": "CF-006/m16", "target_id": "CF-006/m17", "confidence": "medium", "state": "ok", "notes": null }
  ],
  "facts": [
    { "id": "CF-006/bf1", "subject": "Docling", "predicate": "is_licensed_under", "object": "MIT", "unit": null, "sign": null, "qualifier": null, "period": null, "source_node": "CF-006/m03", "provenance": { "document_id": "CF-006", "page_number": 1, "bbox": null, "text_anchor": "MIT-licensed open-source package" }, "confidence": "high", "state": "ok", "notes": null },
    { "id": "CF-006/bf2", "subject": "Docling layout pipeline", "predicate": "feeds_page_images_at", "object": "72", "unit": "dpi", "sign": null, "qualifier": null, "period": null, "source_node": "CF-006/m16", "provenance": { "document_id": "CF-006", "page_number": 3, "bbox": null, "text_anchor": "feeds page images at 72 dpi resolution" }, "confidence": "high", "state": "ok", "notes": null },
    { "id": "CF-006/bf3", "subject": "Docling OCR", "predicate": "feeds_page_image_at", "object": "216", "unit": "dpi", "sign": null, "qualifier": null, "period": null, "source_node": "CF-006/m18", "provenance": { "document_id": "CF-006", "page_number": 4, "bbox": null, "text_anchor": "feeds a high-resolution page image (216 dpi)" }, "confidence": "high", "state": "ok", "notes": null },
    { "id": "CF-006/bf4", "subject": "Docling standard test set", "predicate": "contains", "object": "225", "unit": "pages", "sign": null, "qualifier": null, "period": null, "source_node": "CF-006/m18", "provenance": { "document_id": "CF-006", "page_number": 4, "bbox": null, "text_anchor": "total of 225 pages" }, "confidence": "high", "state": "ok", "notes": null }
  ]
}
