{
  "document_id": "CF-012",
  "annotator": "annotator_b",
  "groundtruth_version": "groundtruth-v0.1-pilot",
  "annotation_status": "single",
  "pilot_slice": { "pages": [2, 3, 4], "description": "IRA statute p2-4 pilot slice." },
  "nodes": [
    { "id": "CF-012/q01", "type": "heading", "subtype": "act_title", "normalized_content": "Public Law 117-169, 117th Congress - An Act", "source_order": 1, "provenance": { "document_id": "CF-012", "page_number": 2, "bbox": null, "text_anchor": "Public Law 117\u2013169" }, "confidence": "high", "state": "ok", "notes": null },
    { "id": "CF-012/q02", "type": "heading", "subtype": "title", "normalized_content": "TITLE I - COMMITTEE ON FINANCE", "source_order": 2, "provenance": { "document_id": "CF-012", "page_number": 2, "bbox": null, "text_anchor": "TITLE I\u2014COMMITTEE ON FINANCE" }, "confidence": "high", "state": "ok", "notes": null },
    { "id": "CF-012/q03", "type": "heading", "subtype": "subtitle", "normalized_content": "Subtitle A - Deficit Reduction", "source_order": 3, "provenance": { "document_id": "CF-012", "page_number": 2, "bbox": null, "text_anchor": "Subtitle A\u2014Deficit Reduction" }, "confidence": "high", "state": "ok", "notes": null },
    { "id": "CF-012/q04", "type": "heading", "subtype": "section", "normalized_content": "SECTION 10001. AMENDMENT OF 1986 CODE.", "source_order": 4, "provenance": { "document_id": "CF-012", "page_number": 2, "bbox": null, "text_anchor": "SECTION 10001. AMENDMENT OF 1986 CODE." }, "confidence": "high", "state": "ok", "notes": null },
    { "id": "CF-012/q05", "type": "paragraph", "normalized_content": "Except as otherwise expressly provided ... the reference shall be considered to be made to a section or other provision of the Internal Revenue Code of 1986.", "source_order": 5, "provenance": { "document_id": "CF-012", "page_number": 2, "bbox": null, "text_anchor": "reference shall be considered to be made to a section or other provision" }, "confidence": "high", "state": "ok", "notes": null },
    { "id": "CF-012/q06", "type": "heading", "subtype": "part", "normalized_content": "PART 1 - CORPORATE TAX REFORM", "source_order": 6, "provenance": { "document_id": "CF-012", "page_number": 2, "bbox": null, "text_anchor": "PART 1\u2014CORPORATE TAX REFORM" }, "confidence": "high", "state": "ok", "notes": null },
    { "id": "CF-012/q07", "type": "heading", "subtype": "section", "normalized_content": "SEC. 10101. CORPORATE ALTERNATIVE MINIMUM TAX.", "source_order": 7, "provenance": { "document_id": "CF-012", "page_number": 2, "bbox": null, "text_anchor": "SEC. 10101. CORPORATE ALTERNATIVE MINIMUM TAX." }, "confidence": "high", "state": "ok", "notes": null },
    { "id": "CF-012/q08", "type": "paragraph", "normalized_content": "(a) IMPOSITION OF TAX ... Paragraph (2) of section 55(b) is amended ... 15 percent of the adjusted financial statement income (as determined under section 56A).", "source_order": 8, "provenance": { "document_id": "CF-012", "page_number": 2, "bbox": null, "text_anchor": "Paragraph (2) of section 55(b) is amended" }, "confidence": "high", "state": "ok", "notes": null },
    { "id": "CF-012/q09", "type": "footnote", "normalized_content": "26 USC 55.", "source_order": 9, "provenance": { "document_id": "CF-012", "page_number": 2, "bbox": null, "text_anchor": "26 USC 55." }, "confidence": "medium", "state": "uncertain", "notes": "Side citation annotated as a footnote (marginal reference)." },
    { "id": "CF-012/q10", "type": "other", "subtype": "page_furniture", "normalized_content": "136 STAT. 1818 PUBLIC LAW 117-169 - AUG. 16, 2022", "source_order": 0, "provenance": { "document_id": "CF-012", "page_number": 2, "bbox": null, "text_anchor": "136 STAT. 1818 PUBLIC LAW 117\u2013169\u2014AUG. 16, 2022" }, "confidence": "high", "state": "ok", "notes": null },
    { "id": "CF-012/q11", "type": "other", "subtype": "defined_term", "normalized_content": "'applicable corporation' means a corporation meeting the average annual adjusted financial statement income test.", "source_order": 11, "provenance": { "document_id": "CF-012", "page_number": 2, "bbox": null, "text_anchor": "the term \u2018applicable corporation\u2019" }, "confidence": "high", "state": "ok", "notes": null },
    { "id": "CF-012/q12", "type": "paragraph", "normalized_content": "a corporation meets the test ... exceeds $1,000,000,000 ... is $100,000,000 or more.", "source_order": 12, "provenance": { "document_id": "CF-012", "page_number": 3, "bbox": null, "text_anchor": "exceeds $1,000,000,000" }, "confidence": "high", "state": "ok", "notes": null },
    { "id": "CF-012/q13", "type": "footnote", "normalized_content": "Definition.", "source_order": 13, "provenance": { "document_id": "CF-012", "page_number": 3, "bbox": null, "text_anchor": "Definition." }, "confidence": "medium", "state": "uncertain", "notes": "Marginal 'Definition.' flag annotated as a footnote." }
  ],
  "edges": [
    { "id": "CF-012/be1", "type": "belongs_to", "source_id": "CF-012/q03", "target_id": "CF-012/q02", "confidence": "high", "state": "ok", "notes": null },
    { "id": "CF-012/be2", "type": "belongs_to", "source_id": "CF-012/q04", "target_id": "CF-012/q03", "confidence": "high", "state": "ok", "notes": null },
    { "id": "CF-012/be3", "type": "belongs_to", "source_id": "CF-012/q06", "target_id": "CF-012/q03", "confidence": "high", "state": "ok", "notes": null },
    { "id": "CF-012/be4", "type": "belongs_to", "source_id": "CF-012/q07", "target_id": "CF-012/q06", "confidence": "high", "state": "ok", "notes": null },
    { "id": "CF-012/be5", "type": "belongs_to", "source_id": "CF-012/q05", "target_id": "CF-012/q04", "confidence": "high", "state": "ok", "notes": null },
    { "id": "CF-012/be6", "type": "belongs_to", "source_id": "CF-012/q08", "target_id": "CF-012/q07", "confidence": "high", "state": "ok", "notes": null },
    { "id": "CF-012/be7", "type": "belongs_to", "source_id": "CF-012/q12", "target_id": "CF-012/q07", "confidence": "medium", "state": "ok", "notes": null },
    { "id": "CF-012/be9", "type": "annotates", "source_id": "CF-012/q09", "target_id": "CF-012/q08", "confidence": "high", "state": "ok", "notes": null },
    { "id": "CF-012/be10", "type": "annotates", "source_id": "CF-012/q13", "target_id": "CF-012/q11", "confidence": "medium", "state": "ok", "notes": null }
  ],
  "facts": [
    { "id": "CF-012/bf1", "subject": "corporate alternative minimum tax rate", "predicate": "is", "object": "15", "unit": "percent", "sign": "positive", "qualifier": "of adjusted financial statement income", "period": "taxable year", "source_node": "CF-012/q08", "provenance": { "document_id": "CF-012", "page_number": 2, "bbox": null, "text_anchor": "15 percent of the adjusted financial statement income" }, "confidence": "high", "state": "ok", "notes": null },
    { "id": "CF-012/bf2", "subject": "average annual adjusted financial statement income test threshold", "predicate": "exceeds", "object": "1000000000", "unit": "USD", "sign": "positive", "qualifier": "3-year average", "period": "ending with the taxable year", "source_node": "CF-012/q12", "provenance": { "document_id": "CF-012", "page_number": 3, "bbox": null, "text_anchor": "exceeds $1,000,000,000" }, "confidence": "high", "state": "ok", "notes": "Digits without separators." },
    { "id": "CF-012/bf3", "subject": "foreign-parented group income threshold", "predicate": "is_at_least", "object": "100000000", "unit": "USD", "sign": "positive", "qualifier": null, "period": "3-taxable-year period", "source_node": "CF-012/q12", "provenance": { "document_id": "CF-012", "page_number": 3, "bbox": null, "text_anchor": "$100,000,000 or more" }, "confidence": "high", "state": "ok", "notes": null },
    { "id": "CF-012/bf4", "subject": "applicable corporation", "predicate": "is_defined_as", "object": "a corporation meeting the average annual adjusted financial statement income test", "unit": null, "sign": null, "qualifier": "excludes S corporation, RIC, REIT", "period": null, "source_node": "CF-012/q11", "provenance": { "document_id": "CF-012", "page_number": 2, "bbox": null, "text_anchor": "the term \u2018applicable corporation\u2019 means" }, "confidence": "high", "state": "ok", "notes": null }
  ]
}
