{
  "document_id": "CF-019",
  "annotator": "adjudicated",
  "groundtruth_version": "groundtruth-v0.1-pilot",
  "annotation_status": "adjudicated",
  "pilot_slice": { "pages": [6, 7, 8, 9], "description": "Adjudicated ground truth for CF-019 pilot slice." },
  "nodes": [
    { "id": "CF-019/p6/toc1", "type": "heading", "normalized_content": "Table of Contents", "source_order": 1, "provenance": { "document_id": "CF-019", "page_number": 6, "bbox": null, "text_anchor": "Table of Contents" }, "confidence": "high", "state": "ok", "notes": null },
    { "id": "CF-019/p6/tl", "type": "list", "subtype": "toc", "normalized_content": "Table of contents entries", "source_order": 2, "provenance": { "document_id": "CF-019", "page_number": 6, "bbox": null, "text_anchor": "1 Introduction 2 Definitions 3 Notation and Conventions 4 Mathematical Preliminaries" }, "confidence": "high", "state": "ok", "notes": null },
    { "id": "CF-019/p6/tl1", "type": "list_item", "normalized_content": "1 Introduction ... 1", "source_order": 3, "provenance": { "document_id": "CF-019", "page_number": 6, "bbox": null, "text_anchor": "Introduction 1" }, "confidence": "high", "state": "ok", "notes": null },
    { "id": "CF-019/p6/tl2", "type": "list_item", "normalized_content": "5 Algorithm Specifications ... 11", "source_order": 4, "provenance": { "document_id": "CF-019", "page_number": 6, "bbox": null, "text_anchor": "Algorithm Speci" }, "confidence": "high", "state": "ok", "notes": null },
    { "id": "CF-019/p8/lot1", "type": "heading", "normalized_content": "List of Tables", "source_order": 5, "provenance": { "document_id": "CF-019", "page_number": 8, "bbox": null, "text_anchor": "List of Tables" }, "confidence": "high", "state": "ok", "notes": null },
    { "id": "CF-019/p8/lotlist", "type": "list", "subtype": "list_of_tables", "normalized_content": "List of tables entries", "source_order": 6, "provenance": { "document_id": "CF-019", "page_number": 8, "bbox": null, "text_anchor": "Table 2 Indices for bytes and bits Table 3 Key-Block-Round Combinations Table 5 Round constants" }, "confidence": "high", "state": "ok", "notes": "ADJUDICATED: a caption reference list (dot leaders + page numbers) is a list, not a data table (guideline changelog GC-9)." },
    { "id": "CF-019/p8/lt1", "type": "list_item", "normalized_content": "Table 1 Hexadecimal representation of 4-bit sequences ... 5", "source_order": 7, "provenance": { "document_id": "CF-019", "page_number": 8, "bbox": null, "text_anchor": "Table 1 Hexadecimal representation of 4-bit sequences" }, "confidence": "high", "state": "ok", "notes": null },
    { "id": "CF-019/p8/lt4", "type": "list_item", "normalized_content": "Table 4 SBOX(): substitution values for the byte xy ... 14", "source_order": 8, "provenance": { "document_id": "CF-019", "page_number": 8, "bbox": null, "text_anchor": "Table 4 SBOX(): substitution values for the byte xy" }, "confidence": "high", "state": "ok", "notes": null },
    { "id": "CF-019/p8/lof1", "type": "heading", "normalized_content": "List of Figures", "source_order": 9, "provenance": { "document_id": "CF-019", "page_number": 8, "bbox": null, "text_anchor": "List of Figures" }, "confidence": "high", "state": "ok", "notes": null },
    { "id": "CF-019/p8/lf1", "type": "list_item", "normalized_content": "Figure 1 State array input and output ... 7", "source_order": 10, "provenance": { "document_id": "CF-019", "page_number": 8, "bbox": null, "text_anchor": "Figure 1 State array input and output" }, "confidence": "high", "state": "ok", "notes": null },
    { "id": "CF-019/p8/tbl1ref", "type": "other", "subtype": "table_reference", "normalized_content": "Table 1 (target on page 5)", "source_order": 11, "provenance": { "document_id": "CF-019", "page_number": 8, "bbox": null, "text_anchor": "Table 1 Hexadecimal representation" }, "confidence": "low", "state": "uncertain", "notes": null },
    { "id": "CF-019/p8/fig1ref", "type": "other", "subtype": "figure_reference", "normalized_content": "Figure 1 (target on page 7)", "source_order": 12, "provenance": { "document_id": "CF-019", "page_number": 8, "bbox": null, "text_anchor": "Figure 1 State array" }, "confidence": "low", "state": "uncertain", "notes": null },
    { "id": "CF-019/p9/hi", "type": "heading", "normalized_content": "1. Introduction", "source_order": 13, "provenance": { "document_id": "CF-019", "page_number": 9, "bbox": null, "text_anchor": "1. Introduction" }, "confidence": "high", "state": "ok", "notes": null },
    { "id": "CF-019/p9/pi", "type": "paragraph", "normalized_content": "In 2000, NIST announced the selection of Rijndael for the AES. This Standard specifies AES-128, AES-192, and AES-256. The block size is 128 bits.", "source_order": 14, "provenance": { "document_id": "CF-019", "page_number": 9, "bbox": null, "text_anchor": "the selection of Rijndael" }, "confidence": "high", "state": "ok", "notes": null }
  ],
  "edges": [
    { "id": "CF-019/e1", "type": "contains", "source_id": "CF-019/p6/tl", "target_id": "CF-019/p6/tl1", "confidence": "high", "state": "ok", "notes": null },
    { "id": "CF-019/e2", "type": "contains", "source_id": "CF-019/p6/tl", "target_id": "CF-019/p6/tl2", "confidence": "high", "state": "ok", "notes": null },
    { "id": "CF-019/e3", "type": "contains", "source_id": "CF-019/p8/lotlist", "target_id": "CF-019/p8/lt1", "confidence": "high", "state": "ok", "notes": null },
    { "id": "CF-019/e4", "type": "contains", "source_id": "CF-019/p8/lotlist", "target_id": "CF-019/p8/lt4", "confidence": "high", "state": "ok", "notes": null },
    { "id": "CF-019/e5", "type": "belongs_to", "source_id": "CF-019/p8/lotlist", "target_id": "CF-019/p8/lot1", "confidence": "high", "state": "ok", "notes": null },
    { "id": "CF-019/e6", "type": "belongs_to", "source_id": "CF-019/p6/tl", "target_id": "CF-019/p6/toc1", "confidence": "high", "state": "ok", "notes": null },
    { "id": "CF-019/e7", "type": "belongs_to", "source_id": "CF-019/p8/lf1", "target_id": "CF-019/p8/lof1", "confidence": "high", "state": "ok", "notes": null },
    { "id": "CF-019/e8", "type": "belongs_to", "source_id": "CF-019/p9/pi", "target_id": "CF-019/p9/hi", "confidence": "high", "state": "ok", "notes": null },
    { "id": "CF-019/e9", "type": "references", "source_id": "CF-019/p8/lt1", "target_id": "CF-019/p8/tbl1ref", "confidence": "high", "state": "ok", "notes": null },
    { "id": "CF-019/e10", "type": "references", "source_id": "CF-019/p8/lf1", "target_id": "CF-019/p8/fig1ref", "confidence": "high", "state": "ok", "notes": null }
  ],
  "facts": [
    { "id": "CF-019/f1", "subject": "AES block size", "predicate": "is", "object": "128", "unit": "bits", "sign": null, "qualifier": "for all key lengths", "period": null, "source_node": "CF-019/p9/pi", "provenance": { "document_id": "CF-019", "page_number": 9, "bbox": null, "text_anchor": "block size (i.e., the length of the data inputs and outputs) is 128 bits" }, "confidence": "high", "state": "ok", "notes": null },
    { "id": "CF-019/f2", "subject": "AES", "predicate": "specifies_instantiations", "object": "AES-128, AES-192, AES-256", "unit": null, "sign": null, "qualifier": "instantiations of Rijndael", "period": null, "source_node": "CF-019/p9/pi", "provenance": { "document_id": "CF-019", "page_number": 9, "bbox": null, "text_anchor": "three instantiations of Rijndael: AES-128, AES-192, and AES-256" }, "confidence": "high", "state": "ok", "notes": null },
    { "id": "CF-019/f3", "subject": "Rijndael", "predicate": "selected_as_AES_in", "object": "2000", "unit": null, "sign": null, "qualifier": null, "period": "2000", "source_node": "CF-019/p9/pi", "provenance": { "document_id": "CF-019", "page_number": 9, "bbox": null, "text_anchor": "In 2000, NIST announced the selection of Rijndael" }, "confidence": "high", "state": "ok", "notes": null }
  ]
}
