{
  "document_id": "CF-004",
  "annotator": "annotator_b",
  "groundtruth_version": "groundtruth-v0.1-pilot",
  "annotation_status": "single",
  "pilot_slice": { "pages": [1, 3, 5, 6], "description": "IRS Data Book front matter pilot slice." },
  "nodes": [
    { "id": "CF-004/s01", "type": "heading", "subtype": "cover_title", "normalized_content": "2025 Internal Revenue Service Data Book", "source_order": 1, "provenance": { "document_id": "CF-004", "page_number": 1, "bbox": null, "text_anchor": "2025 INTERNAL REVENUE SERVICE DATA BOOK" }, "confidence": "high", "state": "ok", "notes": null },
    { "id": "CF-004/s02", "type": "heading", "normalized_content": "Contents", "source_order": 2, "provenance": { "document_id": "CF-004", "page_number": 3, "bbox": null, "text_anchor": "Contents" }, "confidence": "high", "state": "ok", "notes": null },
    { "id": "CF-004/s03", "type": "list", "subtype": "toc", "normalized_content": "Contents entries", "source_order": 3, "provenance": { "document_id": "CF-004", "page_number": 3, "bbox": null, "text_anchor": "Service to Taxpayers Compliance Presence Chief Counsel" }, "confidence": "high", "state": "ok", "notes": null },
    { "id": "CF-004/s04", "type": "list_item", "normalized_content": "Returns Filed, Taxes Collected, and Refunds Issued ... 1", "source_order": 4, "provenance": { "document_id": "CF-004", "page_number": 3, "bbox": null, "text_anchor": "Returns Filed, Taxes Collected, and Refunds Issued" }, "confidence": "high", "state": "ok", "notes": null },
    { "id": "CF-004/s05", "type": "list_item", "normalized_content": "IRS Budget and Workforce ... 73", "source_order": 5, "provenance": { "document_id": "CF-004", "page_number": 3, "bbox": null, "text_anchor": "IRS Budget and Workforce" }, "confidence": "high", "state": "ok", "notes": null },
    { "id": "CF-004/s06", "type": "heading", "normalized_content": "Letter from the Chief Executive Officer", "source_order": 6, "provenance": { "document_id": "CF-004", "page_number": 5, "bbox": null, "text_anchor": "Letter from the Chief Executive Officer" }, "confidence": "high", "state": "ok", "notes": null },
    { "id": "CF-004/s07", "type": "paragraph", "normalized_content": "in FY 2025 the IRS collected more than $5.3 trillion in revenue and processed more than 271.4 million tax returns, including almost 162.8 million individual income tax returns.", "source_order": 7, "provenance": { "document_id": "CF-004", "page_number": 5, "bbox": null, "text_anchor": "collected more than $5.3 trillion in revenue" }, "confidence": "high", "state": "ok", "notes": null },
    { "id": "CF-004/s08", "type": "paragraph", "normalized_content": "There were nearly 417 million inquiries on 'Where's My Refund?' ... up 9 percent from FY 2024.", "source_order": 8, "provenance": { "document_id": "CF-004", "page_number": 5, "bbox": null, "text_anchor": "up 9\npercent from FY 2024" }, "confidence": "high", "state": "ok", "notes": null },
    { "id": "CF-004/s09", "type": "heading", "normalized_content": "List of Statistical Tables", "source_order": 9, "provenance": { "document_id": "CF-004", "page_number": 6, "bbox": null, "text_anchor": "List of Statistical Tables" }, "confidence": "high", "state": "ok", "notes": null },
    { "id": "CF-004/s10", "type": "table", "subtype": "list_of_tables", "normalized_content": "List of statistical tables (caption | page)", "source_order": 10, "provenance": { "document_id": "CF-004", "page_number": 6, "bbox": null, "text_anchor": "Table 1-2 Number of Returns and Other Forms Filed by Type Table 2-1 Selected Taxpayer Assistance" }, "confidence": "medium", "state": "uncertain", "notes": "Aligned caption/page columns read as a table." },
    { "id": "CF-004/s11", "type": "table_row", "normalized_content": "Table 1-1. Collections and Refunds, by Type of Tax, Fiscal Years 2024 and 2025 | 3", "source_order": 11, "provenance": { "document_id": "CF-004", "page_number": 6, "bbox": null, "text_anchor": "Table 1-1.   Collections and Refunds, by Type of Tax, Fiscal Years 2024 and 2025" }, "confidence": "high", "state": "ok", "notes": null },
    { "id": "CF-004/s12", "type": "table_row", "normalized_content": "Table 1-6. Gross Collections, by Type of Tax, Fiscal Years 1960-2025 | 15", "source_order": 12, "provenance": { "document_id": "CF-004", "page_number": 6, "bbox": null, "text_anchor": "Table 1-6.   Gross Collections, by Type of Tax, Fiscal Years 1960" }, "confidence": "high", "state": "ok", "notes": null },
    { "id": "CF-004/s13", "type": "other", "subtype": "table_reference", "normalized_content": "Table 1-1 (target on Data Book page 3)", "source_order": 13, "provenance": { "document_id": "CF-004", "page_number": 6, "bbox": null, "text_anchor": "Collections and Refunds, by Type of Tax" }, "confidence": "low", "state": "uncertain", "notes": null }
  ],
  "edges": [
    { "id": "CF-004/be1", "type": "contains", "source_id": "CF-004/s03", "target_id": "CF-004/s04", "confidence": "high", "state": "ok", "notes": null },
    { "id": "CF-004/be2", "type": "contains", "source_id": "CF-004/s03", "target_id": "CF-004/s05", "confidence": "high", "state": "ok", "notes": null },
    { "id": "CF-004/be3", "type": "contains", "source_id": "CF-004/s10", "target_id": "CF-004/s11", "confidence": "high", "state": "ok", "notes": null },
    { "id": "CF-004/be4", "type": "contains", "source_id": "CF-004/s10", "target_id": "CF-004/s12", "confidence": "high", "state": "ok", "notes": null },
    { "id": "CF-004/be5", "type": "belongs_to", "source_id": "CF-004/s03", "target_id": "CF-004/s02", "confidence": "high", "state": "ok", "notes": null },
    { "id": "CF-004/be6", "type": "belongs_to", "source_id": "CF-004/s10", "target_id": "CF-004/s09", "confidence": "high", "state": "ok", "notes": null },
    { "id": "CF-004/be7", "type": "belongs_to", "source_id": "CF-004/s07", "target_id": "CF-004/s06", "confidence": "high", "state": "ok", "notes": null },
    { "id": "CF-004/be8", "type": "belongs_to", "source_id": "CF-004/s08", "target_id": "CF-004/s06", "confidence": "high", "state": "ok", "notes": null },
    { "id": "CF-004/be9", "type": "references", "source_id": "CF-004/s11", "target_id": "CF-004/s13", "confidence": "high", "state": "ok", "notes": null }
  ],
  "facts": [
    { "id": "CF-004/bf1", "subject": "IRS total revenue collected", "predicate": "collected", "object": "5300000000000", "unit": "USD", "sign": "positive", "qualifier": "more than", "period": "FY2025", "source_node": "CF-004/s07", "provenance": { "document_id": "CF-004", "page_number": 5, "bbox": null, "text_anchor": "collected more than $5.3 trillion in revenue" }, "confidence": "medium", "state": "uncertain", "notes": "Expanded $5.3 trillion to full digits." },
    { "id": "CF-004/bf2", "subject": "tax returns and other forms processed", "predicate": "processed", "object": "271.4", "unit": "million", "sign": "positive", "qualifier": "more than", "period": "FY2025", "source_node": "CF-004/s07", "provenance": { "document_id": "CF-004", "page_number": 5, "bbox": null, "text_anchor": "processed more than 271.4 million tax returns and other" }, "confidence": "high", "state": "ok", "notes": null },
    { "id": "CF-004/bf3", "subject": "individual income tax returns", "predicate": "count", "object": "162.8", "unit": "million", "sign": "positive", "qualifier": "almost", "period": "FY2025", "source_node": "CF-004/s07", "provenance": { "document_id": "CF-004", "page_number": 5, "bbox": null, "text_anchor": "almost 162.8 million individual income" }, "confidence": "high", "state": "ok", "notes": null },
    { "id": "CF-004/bf4", "subject": "Where's My Refund inquiries", "predicate": "increased", "object": "9", "unit": "percent", "sign": "positive", "qualifier": "year over year", "period": "FY2025 vs FY2024", "source_node": "CF-004/s08", "provenance": { "document_id": "CF-004", "page_number": 5, "bbox": null, "text_anchor": "up 9\npercent from FY 2024" }, "confidence": "high", "state": "ok", "notes": null }
  ]
}
